,source,author,title,description,url,urlToImage,publishedAt,content
95,"{'id': None, 'name': ""Investor's Business Daily""}","RYAN DEFFENBAUGH, Investor's Business Daily",How Oracle Got Its Mojo Back. What's Behind The AI Cloud Push Powering Its 80% Stock Gain.,"Oracle stock has rallied 80% this year, with the enterprise tech giant emerging as a favorite on Wall Street to benefit from generative AI.",https://www.investors.com/news/technology/oracle-stock-orcl-ai-cloud-larry-ellison/,https://www.investors.com/wp-content/uploads/2017/12/stock-Oracle-03-shutter.jpg,2024-11-21T18:00:34Z,"Oracle (ORCL) is partying like it's 1999. Oracle stock is tracking to have its best year since the turn of the century as the tech giant joins the euphoria around artificial intelligence, the hot tre… [+15274 chars]"
96,"{'id': None, 'name': 'Biztoc.com'}",benzinga.com,"Market Clubhouse Morning Memo - November 21st, 2024 (Trade Strategy For SPY, QQQ, AAPL, MSFT, NVDA, GOOGL, META And TSLA)","Good Morning Traders! In today's Market Clubhouse Morning Memo, we will discuss SPY, QQQ, AAPL, MSFT, NVDA, GOOGL, META, and TSLA.
Our proprietary formula, exclusive to Market Clubhouse, dictates these price levels. This dynamic equation takes into account pr…",https://biztoc.com/x/46c72efb6019c858,https://biztoc.com/cdn/46c72efb6019c858_s.webp,2024-11-21T16:36:04Z,"Good Morning Traders! In today's Market Clubhouse Morning Memo, we will discuss SPY, QQQ, AAPL, MSFT, NVDA, GOOGL, META, and TSLA.Our proprietary formula, exclusive to Market Clubhouse, dictates thes… [+141 chars]"
97,"{'id': None, 'name': 'Quartz India'}",William Gavin and Rocio Fabbro,The feds want Google to sell its Chrome browser,The Department of Justice (DOJ) said Wednesday that it wants Google (GOOGL) to sell its Chrome web browser as the government looks to break up the tech giant’s dominance in the search engine market.Read more...,https://qz.com/google-sell-chrome-browser-android-doj-feds-tech-1851704663,"https://i.kinja-img.com/image/upload/c_fill,h_675,pg_1,q_80,w_1200/d743bbe864661030cf61879c5c471995.jpg",2024-11-21T13:15:00Z,"In This Story
The Department of Justice (DOJ) said Wednesday that it wants Google (GOOGL-1.22%
) to sell its Chrome web browser as the government looks to break up the tech giants dominance in the … [+2482 chars]"
98,"{'id': None, 'name': 'Forbes'}","Trefis Team, Contributor, 
 Trefis Team, Contributor
 https://www.forbes.com/sites/greatspeculations/people/trefis/",Which Is A Better Pick: JNJ Stock Or AbbVie?,"We compare a slew of factors, such as historical revenue growth, returns, and valuation.",https://www.forbes.com/sites/greatspeculations/2024/11/21/which-is-a-better-pick-jnj-stock-or-abbvie/,https://imageio.forbes.com/specials-images/imageserve/673ea8e4291fc2c862f345e9/0x0.jpg?format=jpg&height=900&width=1600&fit=bounds,2024-11-21T13:00:00Z,"POLAND - 2024/11/17: In this photo illustration, the AbbVie company logo is seen displayed on a ... [+] smartphone screen. (Photo Illustration by Piotr Swat/SOPA Images/LightRocket via Getty Images)… [+8143 chars]"
99,"{'id': None, 'name': 'ETF Daily News'}",MarketBeat News,Chemistry Wealth Management LLC Has $7.10 Million Holdings in Microsoft Co. (NASDAQ:MSFT),"Chemistry Wealth Management LLC boosted its holdings in shares of Microsoft Co. (NASDAQ:MSFT – Free Report) by 2.3% in the 3rd quarter, according to the company in its most recent 13F filing with the Securities & Exchange Commission. The firm owned 16,500 sha…",https://www.etfdailynews.com/2024/11/21/chemistry-wealth-management-llc-has-7-10-million-holdings-in-microsoft-co-nasdaqmsft/,https://www.americanbankingnews.com/wp-content/timthumb/timthumb.php?src=https://www.marketbeat.com/logos/microsoft-corporation-logo-1200x675.png&w=240&h=240&zc=2,2024-11-21T09:16:57Z,"Chemistry Wealth Management LLC boosted its holdings in shares of Microsoft Co. (NASDAQ:MSFT – Free Report) by 2.3% in the 3rd quarter, according to the company in its most recent 13F filing with the… [+7250 chars]"
